{
  "schema_version": 1,
  "profile_evidence_id": "55555555-5555-4555-8555-555555555555",
  "subject_id": "11111111-1111-4111-8111-111111111111",
  "claim": {
    "dimension": "preference.track",
    "value": {
      "value_type": "entity",
      "entity_ref": {
        "entity_type": "track",
        "entity_id": "22222222-2222-4222-8222-222222222222",
        "entity_revision": 1,
        "label": "Synthetic Night Signal"
      }
    }
  },
  "direction": "supports",
  "strength": 0.7,
  "confidence": 0.62,
  "basis_refs": [
    {
      "record_type": "taste_event",
      "record_id": "44444444-4444-4444-8444-444444444444"
    }
  ],
  "derivation": {
    "kind": "direct",
    "name": "explicit-rating-evidence",
    "version": "1"
  },
  "evidence_window": {
    "start_at": "2026-08-23T09:10:00Z",
    "end_at": "2026-08-23T09:20:05Z"
  },
  "created_at": "2026-08-23T09:21:00Z"
}
